Dataid,Brand,Images,Interested_count,Item_description,Likes,Link,MarketStatus,Price,SearchDate,SellerId,SellerName,Size,Title,Upload_date,View_count,Condition,Page,SearchCount
5507574221,ganzitos,[],2.0,"Nuevos, ideales ✨✨ a mitad de precio!!!",7,https://www.vinted.it/items/5507574221-ganzitos-terciopelo-azul-y-negro?referrer=catalog,Sold,60.0,09/12/2024 22:45:31, ,cococarotte72,39.0,Ganzitos terciopelo azul y negro,un'ora,26,Nuovo senza cartellino,8,0
5509399256,Primark,[],1.0,Magnifiques bottes daim marron 37 primark,0,https://www.vinted.it/items/5509399256-magnifiques-bottes-daim-marron-primark-37?referrer=catalog,Sold,13.0,10/12/2024 13:33:29, ,dabcath,37.0,Magnifiques bottes daim marron Primark 37,16 min,5,Nuovo senza cartellino,1,0
5509645353,Isotoner,[],,"Chaussons gris joli, jamais porté, cadeau en double",0,https://www.vinted.it/items/5509645353-chaussons-isotoner?referrer=catalog,Sold,3.5,10/12/2024 14:25:18, ,mauricette37707,37.0,Chaussons isotoner,19 min,4,Nuovo senza cartellino,2,0
5509605606,Tommy Hilfiger,[],1.0,"Ich verkaufe meine neuen TH Stiefeletten in Größe 38. Da die Schuhe nie getragen wurden, sind diese in sehr gutem Zustand.",2,https://www.vinted.it/items/5509605606-tommy-hilfiger-stiefeletten?referrer=catalog,Sold,20.0,10/12/2024 14:25:48, ,jessica3197,38.0,Tommy Hilfiger Stiefeletten,28 min,12,Nuovo senza cartellino,4,0
5509584812,UGG,[],4.0,"Botas novas Leves, quentes e confortáveis",2,https://www.vinted.it/items/5509584812-botas-curtas-ugg?referrer=catalog,Sold,85.0,10/12/2024 14:26:01, ,xannoca,39.0,Botas curtas Ugg,32 min,35,Nuovo senza cartellino,5,0
5515927321,casta,[],1.0,"Bottines Casta (Portugal) Pointure 36, talon 5cm et bout pointu (mais pas trop) bottines en cuir sauf semelle extérieure Prix neuf 179€ Nouvelle collection Vous pouvez voir les bottines sur Spartoo Neuves, jamais portées Par contre, je n'ai plus la boîte Couleur marron et or Très tendance",0,https://www.vinted.it/items/5515927321-bottines-casta?referrer=catalog,Sold,16.0,11/12/2024 22:01:07, ,coco2245,36.0,Bottines Casta,13 min,6,Nuovo senza cartellino,1,0
5515922120,Mango,[],1.0,Usados una vez,1,https://www.vinted.it/items/5515922120-botines-negros-mango?referrer=catalog,Sold,10.0,11/12/2024 22:01:21, ,ainaracm,38.0,Botines negros Mango,15 min,48,Nuovo senza cartellino,2,0
5515803169,Brand non indicato,[],1.0,Boots D Maat 38 Alleen gebruikt voor fotoshoot,1,https://www.vinted.it/items/5515803169-boots-d?referrer=catalog,Sold,18.0,11/12/2024 22:06:30, ,dorienvanderwerve,38.0,Boots D,un'ora,10,Nuovo senza cartellino,6,0
5515797053,Beige,[],1.0,Décolleté tacchi alti beige lucido Taglia 44 Mai usate perché troppo alte per me (sono alta 1.78),2,https://www.vinted.it/items/5515797053-decollete-tacchi-alti-beige-lucido?referrer=catalog,Sold,20.0,11/12/2024 22:02:27, ,b.marta21,44.0,Décolleté tacchi alti beige lucido,un'ora,30,Nuovo senza cartellino,7,0
5515753902,Shein,[],,Jamais porté taille 36,5,https://www.vinted.it/items/5515753902-bottines-chausson-beige?referrer=catalog,Sold,9.0,11/12/2024 22:06:30, ,coline260818,36.0,Bottines chausson beige,un'ora,27,Nuovo senza cartellino,8,0
5515797125,Nike,[],2.0,Como nuevo ningún uso pero sin caja,3,https://www.vinted.it/items/5515797125-nike-tn-talla-37?referrer=catalog,Sold,35.0,11/12/2024 22:04:45, ,hassania1980,37.0,Nike tn talla 37,un'ora,24,Nuovo senza cartellino,4,1
5529640909,Camomilla,[],1.0,Stivaletti tronchetto neri in pelle Camomilla. Numero 39 nuovi mai indossati in perfette condizioni. #stivaletti39 #stivalettidonna39 #stivalettineri #stivalettipelle,1,https://www.vinted.it/items/5529640909-stivaletti-tronchetto-in-pelle-camomilla?referrer=catalog,Sold,12.0,15/12/2024 14:40:47,54,giully22,39.0,Stivaletti tronchetto in pelle Camomilla,29 min,6,Nuovo senza cartellino,6,0
5529751644,Hunter,[],1.0,"Botín agua marca Hunter color negro, como nuevos. Muy cómodos. Usados una vez, los tuve que comprar en un viaje y no son mi estilo. Me costaron 50£!!",0,https://www.vinted.it/items/5529751644-botines-agua-negro?referrer=catalog,Sold,30.0,15/12/2024 14:49:11,55,leyre410,38.0,Botines agua negro,33 min,10,Nuovo senza cartellino,1,0
5529712747,Dr. Martens,[],1.0,"- Dr. Martens Air Wair Jadon Max black - taglia 38 - con scatola e doppi lacci originali - nuove indossate solo due volte, non hanno difetti",0,https://www.vinted.it/items/5529712747-dr-martens-air-wair?referrer=catalog,Sold,80.0,15/12/2024 14:49:11,56,katya1712,38.0,Dr. Martens Air Wair,39 min,22,Nuovo senza cartellino,3,0
5529710113,Vanessa,[],,Descuento hasta -50% en mi armario @nada66026 Si necesitas más información hablarme por privado,0,https://www.vinted.it/items/5529710113-botas-nuevas-por-24eu?referrer=catalog,Sold,24.0,15/12/2024 14:49:11,57,nada66026,38.0,Botas nuevas por 24€ 🔄,40 min,1,Nuovo senza cartellino,3,0
5530055660,Christian Dior,[],,Peut mise,0,https://www.vinted.it/items/5530055660-basket?referrer=catalog,Sold,90.0,15/12/2024 15:24:36,58,justmydressing,39.0,Basket,8 min,5,Nuovo senza cartellino,1,0
5529944540,Rieker,[],1.0,Non sono stati mai indossati,2,https://www.vinted.it/items/5529944540-stivaletti-donna?referrer=catalog,Sold,9.0,15/12/2024 15:30:22,59,rosemaryeva,37.0,Stivaletti donna,38 min,25,Nuovo senza cartellino,6,0
5535061083,adidas,[],1.0,"Adidas court bold neuves Erreur de tailles achetées il y a une semaine à intersport au prix de 79,99 Portées une heure Rose et fluo très sympa à porter",0,https://www.vinted.it/items/5535061083-adidas-court-bold?referrer=catalog,Sold,65.0,16/12/2024 17:56:49,60,cak0o,41.0,Adidas court bold,14 min,2,Nuovo senza cartellino,1,0
5535006365,Tod's,[],,"Einmal um den Block gelaufen:-) Sonst nie getragen!! Achtung!!! Der Absatz klebt komisch und hat ein paar Kratzer siehe Foto. Ich denke die Absätze müssten gemacht werden!! Deswegen der günstige Preis!!!! Bei Fragen gerne melden. Dies ist ein Privatverkauf, daher keine Haftung oder Rücknahme. Danke fürs Verständnis 🥰",0,https://www.vinted.it/items/5535006365-stiefelette-tods-385-grau-wie-neu?referrer=catalog,Sold,42.0,16/12/2024 17:56:49,61,thessak123,38.5,Stiefelette Tod's 38,27 min,5,Nuovo senza cartellino,3,0
5534936203,UGG,[],5.0,"100% IDENTICOS TALLA 36 Muy cómodos , no los he usado , están sin caja y sin etiqueta. Fue un regalo de cumpleaños pero personalmente a mí no me gustan.",7,https://www.vinted.it/items/5534936203-botines-ugg-negros?referrer=catalog,Sold,40.0,16/12/2024 17:52:42,62,leticiadlf92,36.0,Botines ugg negros,43 min,30,Nuovo senza cartellino,6,0
5534935882,Gucci,[],5.0,Je vend mule Gucci femme de taille 38 avec son packajing complet porter une fois .,5,https://www.vinted.it/items/5534935882-mule-gucci-femme?referrer=catalog,Sold,60.0,16/12/2024 17:56:49,63,mamadee69,38.0,Mule Gucci femme,44 min,43,Nuovo senza cartellino,6,0
5534913167,Dr. Martens,[],2.0,Dr. Martens modello alti 20 buchi con suola bex. Originali. Nuove. Numero 38,5,https://www.vinted.it/items/5534913167-dr-martens-alte-20-buchi-bex?referrer=catalog,Sold,100.0,16/12/2024 17:56:49,64,marikatn84,38.0,Dr. Martens alte 20 buchi bex,un'ora,27,Nuovo senza cartellino,7,0
